,id,fecha,temaPrincipal,tipo_evento,subtema,titulo,descripcion,actoresClave,ambito,fuente,conexiones,color
,N-1,1991-03-06,Gobernabilidad y Autonomía,Norma,Normatividad,Ley 21 de 1991 (Convenio 169 de la OIT),"Aprueba el Convenio 169 de la OIT sobre pueblos indígenas y tribales, incorporándolo al ordenamiento interno. Integra estándares internacionales como la consulta previa y la protección de tierras indígenas al bloque de constitucionalidad colombiano.",Congreso de la República,Colombia,Ley 21 de 1991,N-2,#1F2937
,N-2,1991-07-04,Gobernabilidad y Autonomía,Norma,Normatividad,Constitución Política de Colombia de 1991,"Establece a Colombia como un Estado pluriétnico y multicultural, reconociendo la autonomía de los pueblos indígenas, su jurisdicción especial y la propiedad colectiva de sus tierras.",Asamblea Nacional Constituyente,Colombia,Constitución Política de Colombia de 1991,C-1;N-1;N-3,#1F2937
,C-1,1991-07-04,Gobernabilidad y Autonomía,Comunicación,Comunicación,Promulgación de la Constitución Política de 1991,"La nueva Constitución de Colombia reconoce al país como nación pluriétnica y multicultural, garantizando derechos colectivos a los pueblos indígenas (idioma, autonomía territorial, justicia propia, consulta previa), marcando un cambio histórico en su representación legal.","Asamblea Nacional Constituyente, Medios de comunicación",Colombia,Diversos medios de prensa. (1991). Cobertura de la promulgación de la Constitución.,N-2,#1F2937
,C-2,1992-10-12,Derechos Humanos y Paz,Movilización,Comunicación,500 años de Resistencia Indígena,Movilizaciones y pronunciamientos indígenas en Colombia y toda América rechazan la celebración oficial del 'Encuentro de Dos Mundos'. En medios se visibiliza la consigna de '500 años de resistencia' para reivindicar la memoria y denunciar la colonización.,"Organizaciones indígenas, Movimientos sociales",Latinoamérica,Cobertura mediática de protestas. (1992).,,#EF4444
,N-3,1993-12-22,Territorio y Ambiente,Norma,Normatividad,Ley 99 de 1993 (Ley General Ambiental),Crea el Ministerio del Medio Ambiente y regula la gestión ambiental; su Artículo 76 exige la consulta previa a comunidades indígenas y negras antes de autorizar proyectos de explotación de recursos naturales en sus territorios.,Congreso de la República,Colombia,Ley 99 de 1993,N-2,#10B981
,N-4,1994-08-03,Territorio y Ambiente,Norma,Normatividad,Ley 160 de 1994 (Sistema Nacional de Reforma Agraria),"Establece el sistema de reforma agraria; el Capítulo XIV encomienda al Estado estudiar, titular y ampliar resguardos indígenas, dotando de tierras a comunidades sin título y saneando territorios ocupados por terceros.",Congreso de la República,Colombia,Ley 160 de 1994,N-5,#10B981
,N-5,1995-12-07,Territorio y Ambiente,Norma,Normatividad,Decreto 2164 de 1995 (Reglamentación de resguardos),"Reglamenta parcialmente la Ley 160/94 en materia de dotación y titulación de tierras a comunidades indígenas para constituir, reestructurar, ampliar y sanear resguardos.",Presidencia de la República,Colombia,Decreto 2164 de 1995,N-4,#10B981
,C-3,1996-07-05,Derechos Humanos y Paz,Movilización,Comunicación,Toma de la sede de la Conferencia Episcopal en Bogotá,"Unos 3.000 indígenas ocuparon pacíficamente durante 43 días la sede de la Conferencia Episcopal de Colombia, exigiendo cumplimiento de derechos territoriales y el fin de la violencia. La protesta obtuvo amplia cobertura nacional.",Pueblos indígenas movilizados,Colombia,Noticia de prensa. (1996).,N-6;C-4,#EF4444
,N-6,1996-08-08,Gobernabilidad y Autonomía,Acuerdo Político,Normatividad,Decreto 1397 de 1996 (Creación de la CNTI y MPC),"Crea la Comisión Nacional de Territorios Indígenas (CNTI) y la Mesa Permanente de Concertación (MPC) con Pueblos Indígenas, para la concertación de políticas y la coordinación Estado-pueblos indígenas.",Presidencia de la República,Colombia,Decreto 1397 de 1996,C-3;C-4,#1F2937
,C-4,1996-08-08,Gobernabilidad y Autonomía,Comunicación,Comunicación,Creación de la Mesa Permanente de Concertación,"Tras la protesta de 1996, el Gobierno crea por decreto la Mesa Permanente de Concertación entre organizaciones indígenas y el Estado. Este espacio institucionalizado de diálogo es difundido como un avance en la relación Estado-pueblos indígenas.","Gobierno de Colombia, Organizaciones Indígenas",Colombia,Decreto 1397 de 1996.,C-3;N-6,#1F2937
,N-7,1997-02-06,Territorio y Ambiente,Jurisprudencia,Normatividad,Sentencia SU-039/97 (Caso U’wa - Consulta Previa),"La Corte falló a favor del pueblo U’wa, reconociendo que se vulneró su derecho fundamental a la consulta previa ante un proyecto petrolero y ordenando realizar la consulta antes de continuar con la explotación.",Corte Constitucional,Colombia,Sentencia SU-039 de 1997,C-5,#10B981
,C-5,1997-05-20,Territorio y Ambiente,Comunicación,Comunicación,Caso U'wa: Internacionalización de la lucha contra OXY,La Nación U'wa lleva su batalla contra la petrolera Occidental al plano internacional: en 1997 presenta denuncia ante la CIDH y líderes U'wa realizan giras globales. La amenaza colectiva de suicidio para proteger su tierra obtiene amplio eco mediático mundial.,"Nación U'wa, CIDH, Occidental Petroleum",Global,Artículo de prensa internacional. (1997).,N-7;C-12;N-22,#10B981
,N-8,1998-07-10,Gobernabilidad y Autonomía,Norma,Normatividad,Decreto 1320 de 1998 (Consulta previa en recursos naturales),"Reglamenta la consulta previa con comunidades indígenas y negras para la explotación de recursos naturales en sus territorios, definiendo procedimientos y etapas para su realización.",Presidencia de la República,Colombia,Decreto 1320 de 1998,,#1F2937
,N-9,2002-10-24,Gobernabilidad y Autonomía,Jurisprudencia,Normatividad,Sentencia C-891/02 (Consulta en Código de Minas),"Al resolver una demanda contra el Código de Minas (Ley 685/2001), la Corte afirmó la obligación de consulta previa en la expedición de leyes que afecten directamente a comunidades indígenas, considerando viciada la ley por falta de consulta.",Corte Constitucional,Colombia,Sentencia C-891 de 2002,,#1F2937
,M-1,2007-12-15,Gobernabilidad y Autonomía,Mandato ONIC,Gobierno Propio,VII Congreso Nacional de Pueblos Indígenas (ONIC),Decisión histórica de transformar la ONIC en Autoridad Nacional de Gobierno Indígena. Mandato General Art.20-21 rompe con figura de ONG gremial y adopta un modelo de gobierno autónomo propio.,ONIC,Interno,ONIC. (2007). Mandato General - VII Congreso Nacional de Pueblos Indígenas.,M-6,#1F2937
,N-10,2008-01-29,Territorio y Ambiente,Jurisprudencia,Normatividad,Sentencia C-030/08 (Ley Forestal Inexequible),"Declara inexequible la Ley 1021 de 2006 (Ley General Forestal) por haberse expedido sin consulta previa a comunidades indígenas y afrodescendientes, dado que dicha ley afectaba sus derechos territoriales.",Corte Constitucional,Colombia,Sentencia C-030 de 2008,,#10B981
,C-6,2008-10-12,Derechos Humanos y Paz,Movilización,Comunicación,Minga Indígena Nacional (Protestas masivas de 2008),"Más de 10.000 indígenas marchan desde el Cauca hasta Cali en 2008, exigiendo territorio, cumplimiento de acuerdos y fin de la violencia. La 'Minga de Resistencia' recibe gran cobertura mediática nacional.",Movimiento indígena,Colombia,Artículo de prensa / Cobertura TV. (2008).,,#EF4444
,N-11,2009-01-26,Derechos Humanos y Paz,Jurisprudencia,Normatividad,Auto 004 de 2009 (Pueblos en Riesgo de Extinción),"En el marco del estado de cosas inconstitucional por desplazamiento (Sentencia T-025/04), se identifican 34 pueblos indígenas en alto riesgo de exterminio físico y cultural por el conflicto armado.",Corte Constitucional,Colombia,Auto 004 de 2009,C-7;C-11;N-14,#EF4444
,C-7,2009-01-26,Derechos Humanos y Paz,Comunicación,Comunicación,Corte Constitucional alerta sobre riesgo de exterminio indígena,La Corte Constitucional emite el Auto 004/2009 identificando 34 pueblos indígenas en peligro de extinción física y cultural por el conflicto armado. Los medios amplifican la alarma.,"Corte Constitucional, Medios de comunicación",Colombia,Noticia de prensa / Informe judicial. (2009).,N-11;C-11,#EF4444
,N-14,2011-12-09,Derechos Humanos y Paz,Norma,Normatividad,Decreto Ley 4633 de 2011 (Víctimas Indígenas),"Establece medidas de asistencia, atención, reparación integral y restitución de derechos territoriales para las comunidades indígenas víctimas del conflicto armado, reconociendo al 'territorio' como víctima colectiva.",Presidencia de la República,Colombia,Decreto Ley 4633 de 2011,N-11,#EF4444
,M-6,2012-08-15,Gobernabilidad y Autonomía,Mandato ONIC,Gobierno Propio,VIII Congreso Nacional de Pueblos Indígenas (2012),El VIII Congreso ratifica y profundiza la transformación institucional. Declara a la ONIC como 'entidad autónoma pública de carácter especial en el Estado Social de Derecho'.,ONIC,Interno,ONIC. (2012). Mandatos del VIII Congreso Nacional de Pueblos Indígenas.,M-1,#1F2937
,M-13,2016-08-24,Derechos Humanos y Paz,Acuerdo Político,Paz y Derechos,Inclusión del Capítulo Étnico en el Acuerdo Final de Paz (2016),El Acuerdo Final de Paz Gobierno–FARC incorpora un Capítulo Étnico específico. Este capítulo reconoce la desproporcional afectación del conflicto y garantiza derechos en la implementación de la paz.,"Gobierno de Colombia, FARC-EP, ONIC, CONPI, AISO",Externo,Gobierno de Colombia & FARC-EP. (2016). “Acuerdo Final para la Terminación del Conflicto…” (Capítulo Étnico).,M-8,#EF4444
,N-22,2022-01-01,Territorio y Ambiente,Jurisprudencia,Normatividad,Sentencia Corte IDH (Caso Pueblo U’wa vs. Colombia),"La Corte IDH determinó la responsabilidad internacional de Colombia por violaciones a los derechos del pueblo indígena U’wa, al permitir por décadas actividades extractivas y proyectos en su territorio sin consulta adecuada.",Corte Interamericana de Derechos Humanos,Global,"Sentencia Corte IDH, Caso 11.754",C-5;C-12;C-30,#10B981
,N-23,2024-01-11,Territorio y Ambiente,Acuerdo Internacional ,Acuerdo Internacional ,La 16ª Conferencia de las Partes de la Convención sobre la Diversidad Biológica de las Naciones Unidas (COP16),"Durante la COP16 en Colombia, la ONIC y el movimiento indígena lograron avances fundamentales con la creación del Órgano Subsidiario para el artículo 8J, que fortalecerá la participación directa de los pueblos indígenas en decisiones sobre biodiversidad, reconociendo y valorando sus saberes tradicionales. Además, se estableció el Fondo de Cali, un mecanismo internacional que busca garantizar una distribución equitativa de los beneficios del uso de información genética, beneficiando especialmente a comunidades en territorios biodiversos. Estos logros consolidan su papel en la conservación ambiental y promueven una justicia basada en la equidad y el respeto cultural.","ONIC, Ministerio de Ambiente",Global,Naciones Unidas,,#10B981
,N-26,2025-04-30,Salud y Medicina Tradicional,Norma,Normatividad,Decreto 0480 de 2025 (Sistema Indígena de Salud - SISPI),"Establece e implementa el Sistema Indígena de Salud Propia e Intercultural (SISPI) como política de Estado, reconociendo la medicina tradicional y la autonomía de los pueblos indígenas en la gestión de la salud.",Presidencia de la República,Colombia,Decreto 0480 de 2025,C-32;M-9;M-19,#3B82F6
,N-27,2025-04-30,Educación y Conocimiento Indígena,Norma,Normatividad,Decreto 0481 de 2025 (Sistema Educativo Indígena Propio - SEIP),"Reconoce y establece el Sistema Educativo Indígena Propio (SEIP) como política de Estado, garantizando la autonomía educativa de los pueblos indígenas.",Presidencia de la República,Colombia,Decreto 0481 de 2025,M-25;M-9b;M-19b,#F59E0B
,N-28,2025-03-15,Territorio y Ambiente,Norma,Gobernanza Territorial,Decreto 0462 de 2025 (Catastro Multipropósito),"Ordena que la actualización catastral del país incorpore los territorios y las territorialidades indígenas, respetando sus formas de gobierno y usos. Busca mejorar la seguridad jurídica de la propiedad colectiva para la planificación autónoma y protección.","Gobierno de Colombia, DANE, IGAC",Colombia,Decreto 0462 de 2025,F-2;N-2,#10B981
,N-29,2024-05-20,Gobernabilidad y Autonomía,Norma,Autonomía Estadística y Financiera,Decreto 724 de 2024 (Reconocimiento de Datos Propios),"Permite que el DANE utilice autocensos y censos propios de las autoridades indígenas para certificar la población, asegurando una distribución más justa de recursos para salud y educación y fortaleciendo la autogestión financiera.","DANE, Autoridades Indígenas, Ministerio de Hacienda",Colombia,Decreto 724 de 2024,F-3;F-4;F-8,#1F2937
,F-1,2025-10-15,Territorio y Ambiente,Mandato ONIC,Gobernanza Territorial,Reto Futuro: Exigir retiro de empresas en territorios,"Mandato constante de la ONIC para exigir el retiro de empresas que atenten contra los territorios, aplicando la objeción cultural y la movilización como herramientas de resistencia.","ONIC, Comunidades Locales",Colombia,Organización Nacional Indígena de Colombia. (2012). Mandatos del VIII Congreso Nacional.,M-2;M-7,#10B981
,F-2,2026-01-15,Territorio y Ambiente,Mandato ONIC,Gobernanza Territorial,Reto Futuro: Saneamiento y Seguridad Jurídica Territorial,"Impulsar la constitución, ampliación y saneamiento de los resguardos y territorios indígenas, como mandato histórico para garantizar la pervivencia.","ONIC, Agencia Nacional de Tierras",Colombia,Organización Nacional Indígena de Colombia. (2007). Mandatos del VII Congreso Nacional.,M-1;M-7,#10B981
,F-3,2026-02-15,Salud y Medicina Tradicional,Mandato ONIC,Salud Propia,Reto Futuro: Implementación real del SISPI,"Implementar el Sistema Indígena de Salud Propia e Intercultural, basado en la sabiduría ancestral y administrado con autonomía, superando los vacíos de financiación.","ONIC, Ministerio de Salud",Colombia,Organización Nacional Indígena de Colombia. (2012). Mandatos del VIII Congreso Nacional.,M-4;M-10,#3B82F6
,F-4,2026-03-15,Educación y Conocimiento Indígena,Mandato ONIC,Educación Propia,Reto Futuro: Implementación real del SEIP,"Implementar el Sistema Educativo Indígena Propio como política pública, basado en la 'Dignidad Educativa' y la revitalización cultural, asegurando su financiación y régimen laboral.","ONIC, Ministerio de Educación",Colombia,Organización Nacional Indígena de Colombia. (2012). Mandatos del VIII Congreso Nacional.,M-3;M-11,#F59E0B
,F-5,2026-04-15,Gobernabilidad y Autonomía,Mandato ONIC,Justicia Propia,Reto Futuro: Fortalecimiento de la Justicia Propia (JEI),Consolidar los sistemas de justicia propia y coordinar su funcionamiento con la jurisdicción ordinaria y la Jurisdicción Especial para la Paz (JEP).,"ONIC, JEP, Altas Cortes",Colombia,Organización Nacional Indígena de Colombia. (2019). Ley de Gobierno Propio.,M-6,#1F2937
,F-6,2026-05-15,Derechos Humanos y Paz,Mandato ONIC,Mujer y Generaciones,Reto Futuro: Erradicar la Violencia Basada en Género,"Crear y aplicar rutas de atención y sanción dentro de la justicia propia para erradicar la violencia contra mujeres, niñas y niños en los territorios.","ONIC, Consejería de Mujer",Colombia,Organización Nacional Indígena de Colombia. (2019). Ley de Gobierno Propio.,M-5,#EF4444
,F-7,2025-11-15,Territorio y Ambiente,Mandato ONIC,Gobernanza Ambiental,Reto Futuro: Gobernanza Ambiental y Emergencia Climática,"Asumir el rol de autoridades ambientales, exigir una moratoria a la explotación de combustibles fósiles y promover un modelo de manejo territorial propio ante la crisis climática.","ONIC, Ministerio de Ambiente",Colombia,Organización Nacional Indígena de Colombia. (2021). Mandatos del X Congreso Nacional.,M-1;M-2,#10B981
,F-8,2027-01-15,Gobernabilidad y Autonomía,Mandato ONIC,Economía Propia,Reto Futuro: Consolidación de un Modelo Económico Propio,"Desarrollar sistemas de economía propia, consolidar el Banco Indígena y la marca Semilla Nativa para lograr la autosostenibilidad y la soberanía alimentaria.","ONIC, Comunidades productoras",Colombia,Organización Nacional Indígena de Colombia. (2019). Ley de Gobierno Propio.,,#1F2937
,F-9,2026-06-15,Territorio y Ambiente,Vacío Normativo,Gobernanza Ambiental,Vacío Futuro: Ausencia de normativa para la Objeción Cultural,"A pesar de ser un logro normativo del Estado, no hay reglamentación para la Objeción Cultural. El mandato de la ONIC de frenar proyectos tiene una herramienta que no puede usar.","Ministerio del Interior, ONIC",Colombia,Documento de Análisis Normativo.,,#10B981
,F-10,2026-07-01,Salud y Medicina Tradicional,Vacío Normativo,Salud Propia,Vacío Futuro: Falta de reglamentación financiera del SISPI,"El mandato de la ONIC por un SISPI funcional está detenido porque el Ministerio de Salud no ha expedido la resolución de costos, impidiendo su financiación real.","Ministerio de Salud, ONIC",Colombia,Documento de Análisis Normativo.,,#3B82F6
,F-11,2026-07-15,Educación y Conocimiento Indígena,Vacío Normativo,Educación Propia,Vacío Futuro: Falta de reglamentación financiera y laboral del SEIP,El mandato de la ONIC por un SEIP funcional está bloqueado por la falta de normas sobre transferencias de recursos y sobre el régimen laboral de sus educadores.,"Ministerio de Educación, ONIC",Colombia,Documento de Análisis Normativo.,,#F59E0B
